CPU: ID 0x206a7, Processor Type 0x0, Family 0x6, Model 0x2a, Stepping 0x7
Northbridge: 8086:0100 (2nd generation (Sandy Bridge family) Core Processor (Desktop))
Southbridge: 8086:1c5c (H61)
IGD: 8086:0102 (Intel(R) HD 2000 Graphics)

============= GPIOS =============

GPIOBASE = 0x0580 (IO)

gpiobase+0x0000: 0xb96bb9c3 (GPIO_USE_SEL)
gpiobase+0x0000: 0xb96ba1ff (GPIO_USE_SEL) DEFAULT
gpiobase+0x0000: 0x0000183c (GPIO_USE_SEL) DIFF
gpiobase+0x0004: 0xaeff6ec3 (GP_IO_SEL)
gpiobase+0x0004: 0xf6ff6eff (GP_IO_SEL) DEFAULT
gpiobase+0x0004: 0x5800003c (GP_IO_SEL) DIFF
gpiobase+0x0008: 0x00000000 (RESERVED)
gpiobase+0x000c: 0xe8fb6fbd (GP_LVL)
gpiobase+0x000c: 0x02fe0100 (GP_LVL) DEFAULT
gpiobase+0x000c: 0xea056ebd (GP_LVL) DIFF
gpiobase+0x0010: 0x00000000 (RESERVED)
gpiobase+0x0014: 0x00000000 (RESERVED)
gpiobase+0x0018: 0x00040000 (GPO_BLINK)
gpiobase+0x001c: 0x00000000 (GP_SER_BLINK)
gpiobase+0x0020: 0x00080000 (GP_SB_CMDSTS)
gpiobase+0x0024: 0x00000000 (GP_SB_DATA)
gpiobase+0x0028: 0x0000     (GPI_NMI_EN)
gpiobase+0x002a: 0x0000     (GPI_NMI_STS)
gpiobase+0x002c: 0x00002800 (GPI_INV)
gpiobase+0x002c: 0x00000000 (GPI_INV) DEFAULT
gpiobase+0x002c: 0x00002800 (GPI_INV) DIFF
gpiobase+0x0030: 0x020380ff (GPIO_USE_SEL2)
gpiobase+0x0030: 0x020300ff (GPIO_USE_SEL2) DEFAULT
gpiobase+0x0030: 0x00008000 (GPIO_USE_SEL2) DIFF
gpiobase+0x0034: 0x1f57fff4 (GP_IO_SEL2)
gpiobase+0x0038: 0xbeff7fc7 (GP_LVL2)
gpiobase+0x0038: 0xa4aa0007 (GP_LVL2) DEFAULT
gpiobase+0x0038: 0x1a557fc0 (GP_LVL2) DIFF
gpiobase+0x003c: 0x00000000 (RESERVED)
gpiobase+0x0040: 0x00000130 (GPIO_USE_SEL3)
gpiobase+0x0044: 0x00000ff0 (GP_IO_SEL3)
gpiobase+0x0048: 0x00000ddf (GPIO_LVL3)
gpiobase+0x0048: 0x000000c0 (GPIO_LVL3) DEFAULT
gpiobase+0x0048: 0x00000d1f (GPIO_LVL3) DIFF
gpiobase+0x004c: 0x00000000 (RESERVED)
gpiobase+0x0050: 0x00000000 (RESERVED)
gpiobase+0x0054: 0x00000000 (RESERVED)
gpiobase+0x0058: 0x00000000 (RESERVED)
gpiobase+0x005c: 0x00000000 (RESERVED)
gpiobase+0x0060: 0x01000000 (GP_RST_SEL1)
gpiobase+0x0064: 0x00000000 (GP_RST_SEL2)
gpiobase+0x0068: 0x00000000 (GP_RST_SEL3)
gpiobase+0x006c: 0x00000000 (RESERVED)
gpiobase+0x0070: 0x00000000 (RESERVED)
gpiobase+0x0074: 0x00000000 (RESERVED)
gpiobase+0x0078: 0x00000000 (RESERVED)
gpiobase+0x007c: 0x00000000 (RESERVED)



============= RCBA ==============

RCBA = 0xfed1c000 (MEM)

0x0050: 0x812a0654
0x0054: 0x00000789
0x0400: 0x00000500
0x0404: 0x76543210
0x0800: 0x20100808
0x0804: 0x01000404
0x0808: 0x04210444
0x080c: 0x04210000
0x0810: 0x00660000
0x0818: 0x00170017
0x081c: 0x00000f0f
0x0820: 0xf7401111
0x0824: 0x11111111
0x0834: 0x0003303c
0x0838: 0x04124054
0x0984: 0x00100010
0x0988: 0x00400010
0x098c: 0x00440000
0x0990: 0x00002000
0x0994: 0x00006000
0x09b0: 0x00000004
0x1000: 0x20100808
0x1004: 0x01000404
0x1008: 0x04210444
0x100c: 0x01110000
0x1010: 0x00007731
0x1020: 0x20100808
0x1024: 0x01000404
0x1028: 0x04210f11
0x102c: 0x04210000
0x1030: 0x00440010
0x1034: 0x0003303c
0x1038: 0x045a419a
0x1100: 0x00006000
0x1104: 0x00000700
0x1114: 0x00000005
0x1194: 0x00002000
0x1d48: 0x00030000
0x1e90: 0x00fc1801
0x1e94: 0x000200ff
0x1e98: 0x00fc1901
0x1e9c: 0x000200ff
0x2014: 0x80000019
0x2020: 0x81000022
0x2030: 0x82000044
0x2040: 0x87000080
0x2084: 0x00100000
0x2088: 0x00109000
0x2094: 0x00002000
0x20ac: 0x40000000
0x21a4: 0x00023c42
0x21a8: 0x40420080
0x21b0: 0x00000002
0x2230: 0x00010000
0x2238: 0x00000901
0x2240: 0x0003001d
0x2244: 0x000f005d
0x2248: 0x006302e9
0x224c: 0x00810000
0x2250: 0x008d0000
0x2254: 0x00670e88
0x2258: 0x00670b4a
0x2260: 0x0010098d
0x2268: 0x000c0028
0x2270: 0x000c0000
0x2274: 0x00100040
0x2278: 0x007602c4
0x227c: 0x008202ec
0x2280: 0x00280000
0x2284: 0x00340000
0x2288: 0x002a03f8
0x228c: 0x00000001
0x2294: 0x00a00680
0x2298: 0x00ac06a8
0x229c: 0x001d0000
0x22a0: 0x00280000
0x22a4: 0x002d0cb4
0x2304: 0xc0388400
0x2308: 0x28000016
0x230c: 0x4abcb5bc
0x2310: 0xa809605b
0x2314: 0x0a2c0020
0x2318: 0x04b8f2a8
0x231c: 0x074802ac
0x2320: 0x00000002
0x2324: 0x00854c74
0x2328: 0x00421731
0x2330: 0xea00408a
0x2334: 0x20000103
0x2338: 0x00000600
0x2340: 0x003a001b
0x2344: 0x0c0c0000
0x3020: 0xffffffff
0x3024: 0xffffffff
0x3028: 0xffffffff
0x302c: 0xffffffff
0x3030: 0xffffffff
0x3034: 0xffffffff
0x3038: 0xffffffff
0x303c: 0xffffffff
0x3040: 0xffffffff
0x3044: 0xffffffff
0x3048: 0xffffffff
0x304c: 0xffffffff
0x3050: 0xffffffff
0x3054: 0xffffffff
0x3058: 0xffffffff
0x305c: 0xffffffff
0x3060: 0xffffffff
0x3064: 0xffffffff
0x3068: 0xffffffff
0x306c: 0xffffffff
0x3070: 0xffffffff
0x3074: 0xffffffff
0x3078: 0xffffffff
0x307c: 0xffffffff
0x3080: 0xffffffff
0x3084: 0xffffffff
0x3088: 0xffffffff
0x308c: 0xffffffff
0x3090: 0xffffffff
0x3094: 0xffffffff
0x3098: 0xffffffff
0x309c: 0xffffffff
0x30a0: 0xffffffff
0x30a4: 0xffffffff
0x30a8: 0xffffffff
0x30ac: 0xffffffff
0x30b0: 0xffffffff
0x30b4: 0xffffffff
0x30b8: 0xffffffff
0x30bc: 0xffffffff
0x30c0: 0xffffffff
0x30c4: 0xffffffff
0x30c8: 0xffffffff
0x30cc: 0xffffffff
0x30d0: 0xffffffff
0x30d4: 0xffffffff
0x30d8: 0xffffffff
0x30dc: 0xffffffff
0x30e0: 0xffffffff
0x30e4: 0xffffffff
0x30e8: 0xffffffff
0x30ec: 0xffffffff
0x30f0: 0xffffffff
0x30f4: 0xffffffff
0x30f8: 0xffffffff
0x30fc: 0xffffffff
0x3100: 0x00243200
0x3108: 0x00043211
0x310c: 0x43214321
0x3110: 0x00000001
0x3114: 0x30003213
0x3118: 0x00000001
0x311c: 0x00000001
0x3124: 0x00004321
0x3128: 0x00000021
0x3140: 0x00000230
0x3144: 0x32100237
0x3148: 0x00000006
0x314c: 0x00000250
0x3150: 0x00000004
0x3154: 0x00003210
0x315c: 0x00003210
0x3160: 0x00003210
0x31fc: 0x03000000
0x3310: 0x03050100
0x3314: 0x0000000f
0x3318: 0x05000000
0x331c: 0x80000000
0x3324: 0x04000000
0x3340: 0x000fffff
0x3344: 0x00000002
0x3360: 0x0001c000
0x3368: 0x00061100
0x3378: 0x7f8fdfff
0x337c: 0x000003fc
0x3388: 0x00001000
0x3390: 0x0001c000
0x33a0: 0x00000800
0x33b0: 0x00001000
0x33c0: 0x00093900
0x33cc: 0x24653002
0x33d0: 0x062108fe
0x33d4: 0x00670060
0x33d8: 0x07ffffff
0x33f0: 0x30002de4
0x3400: 0x00000004
0x3404: 0x00000080
0x3410: 0x00000c65
0x3414: 0x00000020
0x3418: 0x1dff08e1
0x3424: 0x00060010
0x3428: 0x0000001d
0x3440: 0x80000000
0x3450: 0xfed04000
0x3458: 0xffffffff
0x345c: 0xffffffff
0x3460: 0xffffffff
0x3464: 0xffffffff
0x3468: 0xffffffff
0x346c: 0xffffffff
0x3470: 0xffffffff
0x3474: 0xffffffff
0x3478: 0xffffffff
0x347c: 0xffffffff
0x3480: 0xffffffff
0x3484: 0xffffffff
0x3488: 0xffffffff
0x348c: 0xffffffff
0x3490: 0xffffffff
0x3494: 0xffffffff
0x3498: 0xffffffff
0x349c: 0xffffffff
0x34a0: 0xffffffff
0x34a4: 0xffffffff
0x34a8: 0xffffffff
0x34ac: 0xffffffff
0x34b0: 0xffffffff
0x34b4: 0xffffffff
0x34b8: 0xffffffff
0x34bc: 0xffffffff
0x34c0: 0xffffffff
0x34c4: 0xffffffff
0x34c8: 0xffffffff
0x34cc: 0xffffffff
0x34d0: 0xffffffff
0x34d4: 0xffffffff
0x34d8: 0xffffffff
0x34dc: 0xffffffff
0x34e0: 0xffffffff
0x34e4: 0xffffffff
0x34e8: 0xffffffff
0x34ec: 0xffffffff
0x34f0: 0xffffffff
0x34f4: 0xffffffff
0x34f8: 0xffffffff
0x34fc: 0xffffffff
0x3500: 0x20000f57
0x3504: 0x20000f57
0x3508: 0x20000f57
0x350c: 0x20000f57
0x3510: 0x20000f53
0x3514: 0x20000f53
0x3518: 0x20000f53
0x351c: 0x2000035f
0x3520: 0x2000035f
0x3524: 0x2000035f
0x3528: 0x2000035f
0x352c: 0x2000035f
0x3530: 0x2000035f
0x3534: 0x2000035f
0x3560: 0x020c0001
0x3564: 0x000024a3
0x3568: 0x00040002
0x356c: 0x01000050
0x3570: 0x02000772
0x3574: 0x1b000787
0x3578: 0x1800ff4f
0x357c: 0x0001d630
0x35a0: 0xc0300c03
0x35a4: 0x00300c03
0x36d4: 0x089c0000
0x36e0: 0x11000011
0x36e4: 0x00000123
0x3800: 0x03ff0000
0x3804: 0x00006008
0x3808: 0x003ecfc0
0x3810: 0x4f52505f
0x3814: 0x5f4c4946
0x3818: 0x00230228
0x381c: 0xfffec000
0x3820: 0x00001000
0x3824: 0xfffec000
0x3828: 0x00001000
0x382c: 0xfffec000
0x3830: 0xfec90008
0x3834: 0x000004ff
0x3838: 0xffffffff
0x383c: 0xffffffff
0x3840: 0xffffffff
0x3844: 0xffffffff
0x3848: 0xffffffff
0x384c: 0x25ffffff
0x3850: 0x0000ffff
0x3858: 0x03ff0000
0x385c: 0x01800001
0x3860: 0x00001fff
0x3864: 0x00001fff
0x3890: 0xf87f0484
0x3894: 0x163b5006
0x3898: 0x05200302
0x389c: 0x0006019f
0x38b4: 0x0ff0a55a
0x38c4: 0x00002005
0x38c8: 0x00002005
0x3a00: 0x03020100
0x3a04: 0x07060504
0x3a08: 0x0b0a0908
0x3a0c: 0x0f0e0d0c
0x3a20: 0x06060606
0x3a24: 0x00000606
0x3a28: 0x01010000
0x3a2c: 0x01010404
0x3a60: 0x00000007
0x3a6c: 0x00000001
0x3a80: 0x01041041
0x3a84: 0x00001001
0x3b00: 0xffffffff
0x3b04: 0xffffffff
0x3b08: 0xffffffff
0x3b0c: 0xffffffff
0x3b10: 0xffffffff
0x3b14: 0xffffffff
0x3b18: 0xffffffff
0x3b1c: 0xffffffff
0x3b20: 0xffffffff
0x3b24: 0xffffffff
0x3b28: 0xffffffff
0x3b2c: 0xffffffff
0x3b30: 0xffffffff
0x3b34: 0xffffffff
0x3b38: 0xffffffff
0x3b3c: 0xffffffff
0x3b40: 0xffffffff
0x3b44: 0xffffffff
0x3b48: 0xffffffff
0x3b4c: 0xffffffff
0x3b50: 0xffffffff
0x3b54: 0xffffffff
0x3b58: 0xffffffff
0x3b5c: 0xffffffff
0x3b60: 0xffffffff
0x3b64: 0xffffffff
0x3b68: 0xffffffff
0x3b6c: 0xffffffff
0x3b70: 0xffffffff
0x3b74: 0xffffffff
0x3b78: 0xffffffff
0x3b7c: 0xffffffff
0x3b80: 0xffffffff
0x3b84: 0xffffffff
0x3b88: 0xffffffff
0x3b8c: 0xffffffff
0x3b90: 0xffffffff
0x3b94: 0xffffffff
0x3b98: 0xffffffff
0x3b9c: 0xffffffff
0x3ba0: 0xffffffff
0x3ba4: 0xffffffff
0x3ba8: 0xffffffff
0x3bac: 0xffffffff
0x3bb0: 0xffffffff
0x3bb4: 0xffffffff
0x3bb8: 0xffffffff
0x3bbc: 0xffffffff
0x3bc0: 0xffffffff
0x3bc4: 0xffffffff
0x3bc8: 0xffffffff
0x3bcc: 0xffffffff
0x3bd0: 0xffffffff
0x3bd4: 0xffffffff
0x3bd8: 0xffffffff
0x3bdc: 0xffffffff
0x3be0: 0xffffffff
0x3be4: 0xffffffff
0x3be8: 0xffffffff
0x3bec: 0xffffffff
0x3bf0: 0xffffffff
0x3bf4: 0xffffffff
0x3bf8: 0xffffffff
0x3bfc: 0xffffffff
0x3c00: 0xffffffff
0x3c04: 0xffffffff
0x3c08: 0xffffffff
0x3c0c: 0xffffffff
0x3c10: 0xffffffff
0x3c14: 0xffffffff
0x3c18: 0xffffffff
0x3c1c: 0xffffffff
0x3c20: 0xffffffff
0x3c24: 0xffffffff
0x3c28: 0xffffffff
0x3c2c: 0xffffffff
0x3c30: 0xffffffff
0x3c34: 0xffffffff
0x3c38: 0xffffffff
0x3c3c: 0xffffffff
0x3c40: 0xffffffff
0x3c44: 0xffffffff
0x3c48: 0xffffffff
0x3c4c: 0xffffffff
0x3c50: 0xffffffff
0x3c54: 0xffffffff
0x3c58: 0xffffffff
0x3c5c: 0xffffffff
0x3c60: 0xffffffff
0x3c64: 0xffffffff
0x3c68: 0xffffffff
0x3c6c: 0xffffffff
0x3c70: 0xffffffff
0x3c74: 0xffffffff
0x3c78: 0xffffffff
0x3c7c: 0xffffffff
0x3c80: 0xffffffff
0x3c84: 0xffffffff
0x3c88: 0xffffffff
0x3c8c: 0xffffffff
0x3c90: 0xffffffff
0x3c94: 0xffffffff
0x3c98: 0xffffffff
0x3c9c: 0xffffffff
0x3ca0: 0xffffffff
0x3ca4: 0xffffffff
0x3ca8: 0xffffffff
0x3cac: 0xffffffff
0x3cb0: 0xffffffff
0x3cb4: 0xffffffff
0x3cb8: 0xffffffff
0x3cbc: 0xffffffff
0x3cc0: 0xffffffff
0x3cc4: 0xffffffff
0x3cc8: 0xffffffff
0x3ccc: 0xffffffff
0x3cd0: 0xffffffff
0x3cd4: 0xffffffff
0x3cd8: 0xffffffff
0x3cdc: 0xffffffff
0x3ce0: 0xffffffff
0x3ce4: 0xffffffff
0x3ce8: 0xffffffff
0x3cec: 0xffffffff
0x3cf0: 0xffffffff
0x3cf4: 0xffffffff
0x3cf8: 0xffffffff
0x3cfc: 0xffffffff
0x3d00: 0xffffffff
0x3d04: 0xffffffff
0x3d08: 0xffffffff
0x3d0c: 0xffffffff
0x3d10: 0xffffffff
0x3d14: 0xffffffff
0x3d18: 0xffffffff
0x3d1c: 0xffffffff
0x3d20: 0xffffffff
0x3d24: 0xffffffff
0x3d28: 0xffffffff
0x3d2c: 0xffffffff
0x3d30: 0xffffffff
0x3d34: 0xffffffff
0x3d38: 0xffffffff
0x3d3c: 0xffffffff
0x3d40: 0xffffffff
0x3d44: 0xffffffff
0x3d48: 0xffffffff
0x3d4c: 0xffffffff
0x3d50: 0xffffffff
0x3d54: 0xffffffff
0x3d58: 0xffffffff
0x3d5c: 0xffffffff
0x3d60: 0xffffffff
0x3d64: 0xffffffff
0x3d68: 0xffffffff
0x3d6c: 0xffffffff
0x3d70: 0xffffffff
0x3d74: 0xffffffff
0x3d78: 0xffffffff
0x3d7c: 0xffffffff
0x3d80: 0xffffffff
0x3d84: 0xffffffff
0x3d88: 0xffffffff
0x3d8c: 0xffffffff
0x3d90: 0xffffffff
0x3d94: 0xffffffff
0x3d98: 0xffffffff
0x3d9c: 0xffffffff
0x3da0: 0xffffffff
0x3da4: 0xffffffff
0x3da8: 0xffffffff
0x3dac: 0xffffffff
0x3db0: 0xffffffff
0x3db4: 0xffffffff
0x3db8: 0xffffffff
0x3dbc: 0xffffffff
0x3dc0: 0xffffffff
0x3dc4: 0xffffffff
0x3dc8: 0xffffffff
0x3dcc: 0xffffffff
0x3dd0: 0xffffffff
0x3dd4: 0xffffffff
0x3dd8: 0xffffffff
0x3ddc: 0xffffffff
0x3de0: 0xffffffff
0x3de4: 0xffffffff
0x3de8: 0xffffffff
0x3dec: 0xffffffff
0x3df0: 0xffffffff
0x3df4: 0xffffffff
0x3df8: 0xffffffff
0x3dfc: 0xffffffff
0x3e00: 0xffffffff
0x3e04: 0xffffffff
0x3e08: 0xffffffff
0x3e0c: 0xffffffff
0x3e10: 0xffffffff
0x3e14: 0xffffffff
0x3e18: 0xffffffff
0x3e1c: 0xffffffff
0x3e20: 0xffffffff
0x3e24: 0xffffffff
0x3e28: 0xffffffff
0x3e2c: 0xffffffff
0x3e30: 0xffffffff
0x3e34: 0xffffffff
0x3e38: 0xffffffff
0x3e3c: 0xffffffff
0x3e40: 0xffffffff
0x3e44: 0xffffffff
0x3e48: 0xffffffff
0x3e4c: 0xffffffff
0x3e50: 0xffffffff
0x3e54: 0xffffffff
0x3e58: 0xffffffff
0x3e5c: 0xffffffff
0x3e60: 0xffffffff
0x3e64: 0xffffffff
0x3e68: 0xffffffff
0x3e6c: 0xffffffff
0x3e70: 0xffffffff
0x3e74: 0xffffffff
0x3e78: 0xffffffff
0x3e7c: 0xffffffff
0x3e80: 0xffffffff
0x3e84: 0xffffffff
0x3e88: 0xffffffff
0x3e8c: 0xffffffff
0x3e90: 0xffffffff
0x3e94: 0xffffffff
0x3e98: 0xffffffff
0x3e9c: 0xffffffff
0x3ea0: 0xffffffff
0x3ea4: 0xffffffff
0x3ea8: 0xffffffff
0x3eac: 0xffffffff
0x3eb0: 0xffffffff
0x3eb4: 0xffffffff
0x3eb8: 0xffffffff
0x3ebc: 0xffffffff
0x3ec0: 0xffffffff
0x3ec4: 0xffffffff
0x3ec8: 0xffffffff
0x3ecc: 0xffffffff
0x3ed0: 0xffffffff
0x3ed4: 0xffffffff
0x3ed8: 0xffffffff
0x3edc: 0xffffffff
0x3ee0: 0xffffffff
0x3ee4: 0xffffffff
0x3ee8: 0xffffffff
0x3eec: 0xffffffff
0x3ef0: 0xffffffff
0x3ef4: 0xffffffff
0x3ef8: 0xffffffff
0x3efc: 0xffffffff
0x3f00: 0x0000010b



========== ACPI/PMC =========


========== ABASE/PMBASE =========

PMBASE = 0x0400 (IO)

pmbase+0x0000: 0x0011     (PM1_STS)
pmbase+0x0002: 0x0120     (PM1_EN)
pmbase+0x0004: 0x00000001 (PM1_CNT)
pmbase+0x0008: 0x003ea312 (PM1_TMR)
pmbase+0x000c: 0x00000000 (RESERVED)
pmbase+0x0010: 0x00000000 (RESERVED)
pmbase+0x0014: 0x00000000 (RESERVED)
pmbase+0x0018: 0x00000000 (RESERVED)
pmbase+0x001c: 0x00000000 (RESERVED)
pmbase+0x0020: 0x46810000 (GPE0_STS)
               0x00000000
pmbase+0x0028: 0x00000040 (GPE0_EN)
               0x00000000
pmbase+0x0030: 0x0002203b (SMI_EN)
pmbase+0x0034: 0x00004100 (SMI_STS)
pmbase+0x0038: 0x0800     (ALT_GP_SMI_EN)
pmbase+0x003a: 0x4681     (ALT_GP_SMI_STS)
pmbase+0x003c: 0x00       (UPRWC)
pmbase+0x003d: 0x00       (RESERVED)
pmbase+0x003e: 0x0000     (RESERVED)
pmbase+0x0040: 0x0000     (RESERVED)
pmbase+0x0042: 0x00       (GPE_CNTL)
pmbase+0x0043: 0x00       (RESERVED)
pmbase+0x0044: 0x1320     (DEVACT_STS)
pmbase+0x0046: 0x0000     (RESERVED)
pmbase+0x0048: 0x00000000 (RESERVED)
pmbase+0x004c: 0x00000000 (RESERVED)
pmbase+0x0050: 0x00       (PM2_CNT)
pmbase+0x0051: 0x00       (RESERVED)
pmbase+0x0052: 0x0000     (RESERVED)
pmbase+0x0054: 0x003f2009 (RESERVED)
pmbase+0x0058: 0x00000000 (RESERVED)
pmbase+0x005c: 0x00000000 (RESERVED)
pmbase+0x0060: 0x003f     (TCO_RLD)
pmbase+0x0062: 0x00       (TCO_DAT_IN)
pmbase+0x0063: 0x00       (TCO_DAT_OUT)
pmbase+0x0064: 0x0000     (TCO1_STS)
pmbase+0x0066: 0x0000     (TCO2_STS)
pmbase+0x0068: 0x0800     (TCO1_CNT)
pmbase+0x006a: 0x0008     (TCO2_CNT)
pmbase+0x006c: 0x0000     (TCO_MESSAGE)
pmbase+0x006e: 0x00       (TCO_WDCNT)
pmbase+0x006f: 0x00       (RESERVED)
pmbase+0x0070: 0x03       (SW_IRQ_GEN)
pmbase+0x0071: 0x00       (RESERVED)
pmbase+0x0072: 0x003f     (TCO_TMR)
pmbase+0x0074: 0x00000000 (RESERVED)
pmbase+0x0078: 0x00000000 (RESERVED)
pmbase+0x007c: 0x00000000 (RESERVED)



========== LPC/eSPI =========

Error: Dumping LPC/eSPI on this southbridge is not (yet) supported.



============= MCHBAR ============

MCHBAR = 0xfed10000 (MEM)

0x0004: 0x00001b50
0x0008: 0x00000006
0x000c: 0x000b4294
0x0010: 0x02102211
0x0014: 0x02202111
0x0020: 0x00018f2d
0x0024: 0x00018e2b
0x0030: 0x000000ff
0x0034: 0x00000c09
0x0104: 0x00001b50
0x0108: 0x00000006
0x010c: 0x000b4294
0x0110: 0x02101e11
0x0120: 0x0001932f
0x0130: 0x000000ff
0x0134: 0x00000c09
0x0204: 0x00001b50
0x0208: 0x00000006
0x020c: 0x000b4294
0x0210: 0x02001d1d
0x0214: 0x02001e1f
0x0220: 0x00019c39
0x0224: 0x00019f3c
0x0230: 0x000000ff
0x0234: 0x00000c09
0x0304: 0xffffffff
0x0308: 0x0000ffff
0x030c: 0x000b4294
0x0310: 0x02202120
0x0320: 0x0001a03d
0x0330: 0x000000ff
0x0334: 0x00000c09
0x0404: 0xffffffff
0x0408: 0x0000ffff
0x040c: 0x000b4294
0x0410: 0x01e01e2b
0x0414: 0x01e01e2c
0x0420: 0x0009ac09
0x0424: 0x0009ae0b
0x0430: 0x000000ff
0x0434: 0x00000c09
0x0504: 0xffffffff
0x0508: 0x0000ffff
0x050c: 0x000b4294
0x0510: 0x0220212e
0x0520: 0x0009b00c
0x0530: 0x000000ff
0x0534: 0x00000c09
0x0604: 0xffffffff
0x0608: 0x0000ffff
0x060c: 0x000b4294
0x0610: 0x0240213a
0x0614: 0x02302239
0x0620: 0x0009b412
0x0624: 0x0009b917
0x0630: 0x000000ff
0x0634: 0x00000c09
0x0704: 0xffffffff
0x0708: 0x0000ffff
0x070c: 0x000b4294
0x0710: 0x02302237
0x0720: 0x0009b815
0x0730: 0x000000ff
0x0734: 0x00000c09
0x080c: 0x000b4294
0x0830: 0x000000ff
0x0834: 0x00000c09
0x090c: 0x000b4294
0x0930: 0x000000ff
0x0934: 0x00000c09
0x0a00: 0x00000003
0x0a04: 0x000c4a84
0x0a08: 0x000c4a83
0x0a0c: 0x01fe4040
0x0a10: 0x00003fff
0x0b00: 0x00000001
0x0b04: 0x000c4a84
0x0b08: 0x000c4a83
0x0b0c: 0x01fe400a
0x0b10: 0x00003fff
0x0c00: 0x00000003
0x0c04: 0x000d528a
0x0c14: 0x0324930a
0x0c1c: 0x000002ff
0x0c20: 0x0000ffff
0x0c34: 0x00000f0b
0x0d00: 0x00000001
0x0d04: 0x000d528a
0x0d14: 0x0124924a
0x0d1c: 0x000002ff
0x0d20: 0x0000ffff
0x0d34: 0x00000f0b
0x0e00: 0x00000003
0x0e04: 0x000c4a84
0x0e08: 0x000c4a83
0x0e0c: 0x01fe4040
0x0e10: 0x00003fff
0x0f00: 0x00000001
0x0f04: 0x000c4a84
0x0f08: 0x000c4a83
0x0f0c: 0x01fe400a
0x0f10: 0x00003fff
0x1004: 0xffffffff
0x100c: 0x000b4294
0x1010: 0x02112110
0x1014: 0x02012110
0x1020: 0x0002021f
0x1024: 0x00020623
0x1030: 0x000000ff
0x1034: 0x00000c09
0x1104: 0xffffffff
0x110c: 0x000b4294
0x1110: 0x02112011
0x1120: 0x00021330
0x1130: 0x000000ff
0x1134: 0x00000c09
0x1204: 0xffffffff
0x120c: 0x000b4294
0x1210: 0x02111e18
0x1214: 0x02111e1b
0x1220: 0x00020f2c
0x1224: 0x0002122f
0x1230: 0x000000ff
0x1234: 0x00000c09
0x1304: 0xffffffff
0x130c: 0x000b4294
0x1310: 0x02212116
0x1320: 0x00021d3b
0x1330: 0x000000ff
0x1334: 0x00000c09
0x1404: 0xffffffff
0x140c: 0x000b4294
0x1410: 0x02211e28
0x1414: 0x02211e28
0x1420: 0x00021c3a
0x1424: 0x00021e3b
0x1430: 0x000000ff
0x1434: 0x00000c09
0x1504: 0xffffffff
0x150c: 0x000b4294
0x1510: 0x0231202b
0x1520: 0x00021f3e
0x1530: 0x000000ff
0x1534: 0x00000c09
0x1604: 0xffffffff
0x160c: 0x000b4294
0x1610: 0x01e11f33
0x1614: 0x01f11f34
0x1620: 0x00021d3b
0x1624: 0x000a2200
0x1630: 0x000000ff
0x1634: 0x00000c09
0x1704: 0xffffffff
0x170c: 0x000b4294
0x1710: 0x02112132
0x1720: 0x000a2502
0x1730: 0x000000ff
0x1734: 0x00000c09
0x1810: 0x0c324324
0x1814: 0x0ca57a4c
0x1818: 0x00000400
0x1910: 0x0c324324
0x1914: 0x0ca57a4c
0x1918: 0x00000400
0x4000: 0x00187999
0x4004: 0x0a145454
0x4008: 0x0a022220
0x400c: 0x00005690
0x4020: 0x10100005
0x4024: 0x20202222
0x4028: 0x000e0011
0x40a8: 0x01000040
0x40ac: 0x00000040
0x40b0: 0x00000040
0x40b4: 0xffffffff
0x40b8: 0x00040000
0x4200: 0x00060002
0x4204: 0x00060400
0x4208: 0x01000320
0x420c: 0x01060400
0x4214: 0x00000288
0x4218: 0x00000242
0x421c: 0x00000240
0x4220: 0x00000007
0x4224: 0x0001f003
0x4228: 0x0001f105
0x422c: 0x0001f002
0x4230: 0x000f1001
0x4234: 0x01901001
0x4238: 0x04281064
0x423c: 0x00280c01
0x4244: 0x000407e3
0x4248: 0x000407e3
0x4280: 0x0000ffff
0x4284: 0x00040000
0x428c: 0x00000044
0x4290: 0x00004080
0x4294: 0x0002980f
0x4298: 0x5a6c144f
0x429c: 0x00004250
0x42a0: 0x00001003
0x42a4: 0x41f97200
0x4380: 0x00000aaa
0x4388: 0xffff03ff
0x438c: 0x551d1519
0x4400: 0x00187999
0x4404: 0x0a145454
0x4408: 0x0a024220
0x440c: 0x00005690
0x4420: 0x10100005
0x4424: 0x20202022
0x4428: 0x000e0001
0x44a8: 0x01000040
0x44ac: 0x00000040
0x44b0: 0x00000040
0x44b4: 0xffffffff
0x44b8: 0x00040000
0x4600: 0x00060002
0x4604: 0x00060400
0x4608: 0x00000320
0x460c: 0x00060400
0x4614: 0x00000288
0x4618: 0x00000242
0x461c: 0x00000240
0x4620: 0x00000007
0x4624: 0x0001f003
0x4628: 0x0001f105
0x462c: 0x0001f002
0x4630: 0x000f1001
0x4634: 0x01901001
0x4638: 0x04281064
0x463c: 0x00280c01
0x4644: 0x000407e3
0x4648: 0x000407e3
0x4680: 0x0000ffff
0x4684: 0x00040000
0x468c: 0x00000044
0x4690: 0x00004080
0x4694: 0x0002980f
0x4698: 0x5a6c144f
0x469c: 0x00004210
0x46a0: 0x00001001
0x46a4: 0x41f97200
0x4780: 0x00000aaa
0x4788: 0xffff03ff
0x478c: 0x551d1519
0x4c00: 0x00187999
0x4c04: 0x0a145454
0x4c08: 0x0a022220
0x4c0c: 0x00005690
0x4c20: 0x10100005
0x4c24: 0x20202222
0x4c28: 0x000e0011
0x4ca8: 0x01000040
0x4cac: 0x00000040
0x4cb0: 0x00000040
0x4cb4: 0xffffffff
0x4cb8: 0x00040000
0x4e00: 0x00060002
0x4e04: 0x00060400
0x4e08: 0x01000320
0x4e0c: 0x01060400
0x4e14: 0x00000288
0x4e18: 0x00000242
0x4e1c: 0x00000240
0x4e20: 0x00000007
0x4e24: 0x0001f003
0x4e28: 0x0001f105
0x4e2c: 0x0001f002
0x4e30: 0x000f1001
0x4e34: 0x01901001
0x4e38: 0x04281064
0x4e3c: 0x00280c01
0x4e44: 0x000407e3
0x4e48: 0x000407e3
0x4e80: 0x0000ffff
0x4e84: 0x00040000
0x4e8c: 0x00000044
0x4e90: 0x00004080
0x4e94: 0x0002980f
0x4e98: 0x5a6c144f
0x4e9c: 0x00004250
0x4ea0: 0x00001003
0x4ea4: 0x41f97200
0x4f80: 0x00000aaa
0x4f88: 0xffff03ff
0x4f8c: 0x551d1519
0x5000: 0x00000024
0x5004: 0x00620010
0x5008: 0x00600008
0x500c: 0x00600000
0x5014: 0x08100000
0x5020: 0x00000006
0x5030: 0x0000019f
0x5034: 0x01020000
0x5040: 0x645c547b
0x5044: 0x9a3bfb7d
0x5048: 0xd29c5870
0x5050: 0xec7eebeb
0x5054: 0x649a9709
0x5058: 0x897cddf7
0x5060: 0x000100ff
0x5064: 0x000330f0
0x5074: 0x00000010
0x5080: 0x00002016
0x5084: 0x0001044c
0x5094: 0xffffffff
0x541c: 0x30000000
0x5500: 0x00100001
0x58a0: 0x0100ffff
0x5920: 0x0000001f
0x5924: 0x00000010
0x5928: 0x08aefb93
0x592c: 0x14aa6432
0x5930: 0x01e00208
0x5934: 0x000a02a0
0x5938: 0x000a1003
0x593c: 0x1cb32266
0x5944: 0x00000028
0x5948: 0x00001100
0x5954: 0x00040000
0x5958: 0x60011f00
0x595c: 0x00001000
0x5960: 0x00000050
0x5964: 0xd0a07818
0x5968: 0xd0a07408
0x596c: 0x2656aa4d
0x5970: 0x68e8f8da
0x5974: 0x68e8f8d8
0x5978: 0x00000032
0x597c: 0x00000032
0x5980: 0x00000031
0x5984: 0xb0a6abbb
0x5990: 0x000000ff
0x5994: 0x000000ff
0x5998: 0x00111116
0x599c: 0x00661400
0x59b0: 0x000008c0
0x59b4: 0x18141494
0x59b8: 0x000008c0
0x59bc: 0x18141494
0x59c0: 0x88350000
0x5d10: 0x16040307
0x5d14: 0x80000000
0x5d20: 0x00000005
0x5d40: 0x00824c1f
0x5d44: 0x00006400
0x5d48: 0x00000200
0x5d4c: 0x001f10a0
0x5da8: 0x00000001
0x5e00: 0x00000005
0x5e04: 0x00000005
0x5efc: 0xffff0000
0x5f00: 0x00002707
0x5f04: 0x1800001a
0x5f08: 0x0000001a
0x5f0c: 0x1800001a
0x5f10: 0x32039020
0x5f14: 0x801db100
0x5f18: 0x1b016000
0x6000: 0x00000004
0x6008: 0x800000d8
0x6010: 0xfff00000
0x6014: 0x0000007f
0x6030: 0x000700b0
0x6034: 0x000700b0
0x6200: 0x88340000
0x6204: 0x0000000f
0x6410: 0x00000f00
0x6430: 0x00fac688
0x6434: 0x00fac688
0x6440: 0x00663000
0x6444: 0x13edc000
0x6800: 0x00000044
0x7000: 0x00444444
0x7400: 0x09249249
0x7404: 0x00120249
0x7408: 0x01ffffff
0x740c: 0xb124f851
0x7410: 0x00000017
0x7500: 0x000f0000
0x7504: 0x000000b0
0x7800: 0x00444444
0x7804: 0x00004444
 .tCK = TCK_MHZ666,
.rankmap = { 0x3, 0x1 },
.mad_dimm = { 0x620010, 0x600008 },
.mobile = 1,
.CAS = 9 /* 9 clocks = 13.500 ns */,
.tWR = 10 /* 10 clocks = 15.000 ns */,
.reg_4004_b30 = { 0, 0 },
.tFAW = 20 /* 20 clocks = 30.000 ns */,
.tWTR = 5 /* 5 clocks = 7.500 ns */,
.tCKE = 4 /* 4 clocks = 6.000 ns */,
.tRTP = 5 /* 5 clocks = 7.500 ns */,
.tRRD = 4 /* 4 clocks = 6.000 ns */,
.tRAS = 24 /* 24 clocks = 36.000 ns */,
.tCWL = 7 /* 7 clocks = 10.500 ns */,
.tRP = 9 /* 9 clocks = 13.500 ns */,
.tRCD = 9 /* 9 clocks = 13.500 ns */,
.tXPDLL = 16 /* 16 clocks = 24.000 ns */,
.tXP = 4 /* 4 clocks = 6.000 ns */,
.tAONPD = 6 /* 6 clocks = 9.000 ns */,
.tREFI = 5199 /* 5199 clocks = 7798.500 ns */,
.tRFC = 108 /* 108 clocks = 162.000 ns */,
.tMOD = 12 /* 12 clocks = 18.000 ns */,
.tXSOffset = 7 /* 7 clocks = 10.500 ns */,
.reg5064b0 = 0xf0,
/* mismatch 0x330f0000, 0x73.  */
.channel_size_mb = { ?, 2048 },
/* CH0S0: 4096 MiB  */
/* CH1S0: 2048 MiB  */
/* SPD matching current mode:  */
/* CH0S0  */
00: 92 11 0b 03 03 00 00 09 03 52 01 08 0c 00 20 00 
10: 6c 78 6c 30 6c 11 20 81 10 05 3c 3c 00 f0 00 00 
20: 00 00 00 00 00 00 00 00 00 00 00 00 00 00 00 00 
30: 00 00 00 00 00 00 00 00 00 00 00 00 00 00 65 00 
40: 00 00 00 00 00 00 00 00 00 00 00 00 00 00 00 00 
50: 00 00 00 00 00 00 00 00 00 00 00 00 00 00 00 00 
60: 00 00 00 00 00 00 00 00 00 00 00 00 00 00 00 00 
70: 00 00 00 00 00 00 00 00 00 00 00 00 00 00 41 2e 
80: 00 00 00 00 00 00 00 00 00 00 00 00 00 00 00 00 
90: 00 00 00 00 00 00 00 00 00 00 00 00 00 00 00 00 
a0: 00 00 00 00 00 00 00 00 00 00 00 00 00 00 00 00 
b0: 00 00 00 00 00 00 00 00 00 00 00 00 00 00 00 00 
c0: 00 00 00 00 00 00 00 00 00 00 00 00 00 00 00 00 
d0: 00 00 00 00 00 00 00 00 00 00 00 00 00 00 00 00 
e0: 00 00 00 00 00 00 00 00 00 00 00 00 00 00 00 00 
f0: 00 00 00 00 00 00 00 00 00 00 00 00 00 00 00 00 

/* CH1S0  */
00: 92 11 0b 03 03 00 00 01 03 52 01 08 0c 00 20 00 
10: 6c 78 6c 30 6c 11 20 81 10 05 3c 3c 00 f0 00 00 
20: 00 00 00 00 00 00 00 00 00 00 00 00 00 00 00 00 
30: 00 00 00 00 00 00 00 00 00 00 00 00 00 00 65 00 
40: 00 00 00 00 00 00 00 00 00 00 00 00 00 00 00 00 
50: 00 00 00 00 00 Error mapping PCIEXBAR: Operation not permitted
00 00 00 00 00 00 00 00 00 00 00 
60: 00 00 00 00 00 00 00 00 00 00 00 00 00 00 00 00 
70: 00 00 00 00 00 00 00 00 00 00 00 00 00 00 9a 02 
80: 00 00 00 00 00 00 00 00 00 00 00 00 00 00 00 00 
90: 00 00 00 00 00 00 00 00 00 00 00 00 00 00 00 00 
a0: 00 00 00 00 00 00 00 00 00 00 00 00 00 00 00 00 
b0: 00 00 00 00 00 00 00 00 00 00 00 00 00 00 00 00 
c0: 00 00 00 00 00 00 00 00 00 00 00 00 00 00 00 00 
d0: 00 00 00 00 00 00 00 00 00 00 00 00 00 00 00 00 
e0: 00 00 00 00 00 00 00 00 00 00 00 00 00 00 00 00 
f0: 00 00 00 00 00 00 00 00 00 00 00 00 00 00 00 00 




============= EPBAR =============

EPBAR = 0xfed19000 (MEM)

0x0000: 0x04010002
0x0004: 0x00000001
0x0010: 0x00000001
0x0014: 0x800000ff
0x001c: 0x00008001
0x0020: 0x81000002
0x0040: 0x00010005
0x0044: 0x00010501
0x0050: 0x01010001
0x0058: 0xfed18000
0x0060: 0x02000002
0x0070: 0x03000002
0x0080: 0x04000002
0x0090: 0x05000002



============= DMIBAR ============

DMIBAR = 0xfed18000 (MEM)

dmibase+0x0000: 0x04010002 (DMI VCECH)
dmibase+0x0004: 0x00000001 (DMI PVCCAP1)
dmibase+0x0008: 0x00000000 (DMI PVVAP2)
dmibase+0x000c: 0x0000     (DMI PVCCTL)
dmibase+0x0010: 0x00000001 (DMI VC0RCAP)
dmibase+0x0014: 0x80000019 (DMI VC0RCTL)
dmibase+0x001a: 0x0000     (DMI VC0RSTS)
dmibase+0x001c: 0x00008001 (DMI VC1RCAP)
dmibase+0x0020: 0x81000022 (DMI VC1RCTL)
dmibase+0x0026: 0x0000     (DMI VC1RSTS)
dmibase+0x0028: 0x00000001 (DMI VCPRCAP)
dmibase+0x002c: 0x82000044 (DMI VCPRCTL)
dmibase+0x0032: 0x0000     (DMI VCPRSTS)
dmibase+0x0034: 0x00008000 (DMI VCMRCAP)
dmibase+0x0038: 0x87000080 (DMI VCMRCTL)
dmibase+0x003e: 0x0000     (DMI VCMRSTS)
dmibase+0x0044: 0x01010202 (DMI ESC)
dmibase+0x0050: 0x00020001 (DMI LE1D)
dmibase+0x0058: 0xfed1c000 (DMI LE1A)
dmibase+0x005c: 0x00000000 (DMI LUE1A)
dmibase+0x0060: 0x00010001 (DMI LE2D)
dmibase+0x0068: 0xfed19000 (DMI LE2A)
dmibase+0x0084: 0x00012c42 (LCAP)
dmibase+0x0088: 0x0002     (LCTL)
dmibase+0x008a: 0x0042     (LSTS)
dmibase+0x0098: 0x0002     (LCTL2)
dmibase+0x009a: 0x0000     (LSTS2)
dmibase+0x0bc0: 0xe978861c (AFE_BMUF0)
dmibase+0x0bc4: 0x0001505b (RSVD)
dmibase+0x0bc8: 0x00375af6 (RSVD)
dmibase+0x0bcc: 0x01100000 (AFE_BMUT0)


========= PCIEXBAR ========

PCIEXBAR: 0xf4000000
Error mapping physical memory 0xf4000000[0x4000000]
