superiotool r4.14-92-g9ea62fe6de
Found ITE IT8728F (id=0x8728, rev=0x1) at 0x2e
Register dump:
idx   val    def
0x02: 0x00   (NA)
0x07: 0x10   (NA)
0x20: 0x87   (0x87)
0x21: 0x28   (0x28)
0x22: 0x01   (0x01)
0x23: 0xc0   (0x00)
0x24: 0x00   (0x00)
0x2b: 0x48   (MM)
0x2e: 0x00   (0x00)
0x2f: 0x00   (0x00)

LDN 0x00 (Floppy)
idx   val    def
0x30: 0x00   (0x00)
0x60: 0x00   (0x03)
0x61: 0x00   (0xf0)
0x70: 0x00   (0x06)
0x74: 0x04   (0x02)
0xf0: 0x00   (0x00)
0xf1: 0x80   (0x00)

LDN 0x01 (COM1)
idx   val    def
0x30: 0x01   (0x00)
0x60: 0x03   (0x03)
0x61: 0xf8   (0xf8)
0x70: 0x04   (0x04)
0xf0: 0x00   (0x00)
0xf1: 0x50   (0x50)

LDN 0x02 (COM2)
idx   val    def
0x30: 0x00   (0x00)
0x60: 0x00   (0x02)
0x61: 0x00   (0xf8)
0x70: 0x00   (0x03)
0xf0: 0x00   (0x00)
0xf1: 0x50   (0x50)

LDN 0x03 (Parallel port)
idx   val    def
0x30: 0x01   (0x00)
0x60: 0x03   (0x03)
0x61: 0x78   (0x78)
0x62: 0x00   (0x07)
0x63: 0x00   (0x78)
0x70: 0x07   (0x07)
0x74: 0x04   (0x03)
0xf0: 0x08   (0x03)

LDN 0x04 (Environment controller)
idx   val    def
0x30: 0x01   (0x00)
0x60: 0x02   (0x02)
0x61: 0x90   (0x90)
0x62: 0x00   (0x02)
0x63: 0x00   (0x30)
0x70: 0x00   (0x09)
0xf0: 0x18   (0x00)
0xf1: 0x00   (0x00)
0xf2: 0x0e   (0x00)
0xf3: 0x00   (0x00)
0xf4: 0x0a   (0x00)
0xf5: 0x03   (MM)
0xf6: 0xf1   (MM)
0xf9: 0x4a   (MM)
0xfa: 0x00   (MM)
0xfb: 0x00   (MM)

LDN 0x05 (Keyboard)
idx   val    def
0x30: 0x01   (0x01)
0x60: 0x00   (0x00)
0x61: 0x60   (0x60)
0x62: 0x00   (0x00)
0x63: 0x64   (0x64)
0x70: 0x01   (0x01)
0x71: 0x02   (0x02)
0xf0: 0x68   (0x48)

LDN 0x06 (Mouse)
idx   val    def
0x30: 0x00   (0x00)
0x70: 0x00   (0x0c)
0x71: 0x02   (0x02)
0xf0: 0x00   (0x00)

LDN 0x07 (GPIO)
idx   val    def
0x25: 0x10   (0x00)
0x26: 0xfb   (0xf3)
0x27: 0x10   (0x00)
0x28: 0x00   (0x00)
0x29: 0x00   (0x00)
0x2a: 0x10   (0x00)
0x2c: 0x01   (0x03)
0x2d: 0x00   (0x00)
0x60: 0x00   (0x00)
0x61: 0x00   (0x00)
0x62: 0x08   (0x00)
0x63: 0x00   (0x00)
0x64: 0x00   (0x00)
0x65: 0x00   (0x00)
0x70: 0x00   (0x00)
0x71: 0x00   (0x00)
0x72: 0x00   (0x20)
0x73: 0x00   (0x38)
0x74: 0x00   (0x00)
0xb0: 0x00   (0x00)
0xb1: 0x00   (0x00)
0xb2: 0x00   (0x00)
0xb3: 0x00   (0x00)
0xb4: 0x00   (0x00)
0xb8: 0x20   (0x20)
0xb9: 0x00   (0x00)
0xba: 0x00   (0x00)
0xbb: 0x00   (0x00)
0xbc: 0x00   (0x00)
0xbd: 0x00   (0x00)
0xc0: 0x11   (0x01)
0xc1: 0xfb   (0x00)
0xc2: 0x00   (0x00)
0xc3: 0x40   (0x40)
0xc4: 0x00   (0x00)
0xc8: 0x11   (0x01)
0xc9: 0x00   (0x00)
0xca: 0x00   (0x00)
0xcb: 0x00   (0x40)
0xcc: 0x00   (0x00)
0xcd: 0x00   (0x00)
0xce: 0x00   (0x00)
0xcf: 0x00   (0x00)
0xe0: 0x00   (0x00)
0xe1: 0x00   (0x00)
0xe2: 0x00   (0x00)
0xe3: 0x00   (0x00)
0xe4: 0x00   (0x00)
0xe9: 0x01   (MM)
0xf0: 0x10   (0x00)
0xf1: 0x40   (0x00)
0xf2: 0x00   (0x00)
0xf3: 0x00   (0x00)
0xf4: 0x00   (0x00)
0xf5: 0x00   (0x00)
0xf6: 0x1c   (0x00)
0xf7: 0x00   (0x00)
0xf8: 0x00   (0x00)
0xf9: 0x00   (0x00)
0xfa: 0x00   (0x00)
0xfb: 0x00   (0x00)

LDN 0x0a (Consumer IR)
idx   val    def
0x30: 0x00   (0x00)
0x60: 0x03   (0x03)
0x61: 0x10   (0x10)
0x70: 0x0b   (0x0b)
0xf0: 0x06   (0x06)

Environment controller (0x0295)
Register dump:
idx   val    def
0x00: 0x13   (0x18)
0x01: 0x12   (0x00)
0x02: 0x00   (0x00)
0x03: 0x00   (0x00)
0x04: 0xff   (0x00)
0x05: 0xff   (0x00)
0x06: 0x00   (0x00)
0x07: 0x37   (0x00)
0x08: 0xff   (0x00)
0x09: 0x87   (0x80)
0x0a: 0x64   (0x58)
0x0b: 0x0f   (0x0f)
0x0c: 0x07   (0x00)
0x0d: 0x0c   (MM)
0x0e: 0xff   (MM)
0x0f: 0x00   (MM)
0x10: 0xfe   (MM)
0x11: 0xfe   (MM)
0x12: 0xff   (MM)
0x13: 0x36   (0x07)
0x14: 0xc7   (0x40)
0x15: 0x82   (0x00)
0x16: 0x80   (0x00)
0x17: 0x82   (0x00)
0x18: 0x02   (NA)
0x19: 0xff   (NA)
0x1a: 0x00   (NA)
0x1b: 0xff   (MM)
0x1c: 0xff   (MM)
0x1d: 0xff   (MM)
0x20: 0x57   (NA)
0x21: 0xba   (NA)
0x22: 0xf0   (NA)
0x23: 0x79   (NA)
0x24: 0xba   (NA)
0x25: 0x5c   (NA)
0x26: 0x7c   (NA)
0x28: 0x7c   (NA)
0x29: 0x2a   (NA)
0x2a: 0x7f   (NA)
0x2b: 0x2c   (NA)
0x30: 0xff   (MM)
0x31: 0x00   (MM)
0x32: 0xff   (MM)
0x33: 0x00   (MM)
0x34: 0xff   (MM)
0x35: 0x00   (MM)
0x36: 0xff   (MM)
0x37: 0x00   (MM)
0x38: 0xff   (MM)
0x39: 0x00   (MM)
0x3a: 0xff   (MM)
0x3b: 0x00   (MM)
0x3c: 0xff   (MM)
0x3d: 0x00   (MM)
0x3e: 0xff   (MM)
0x3f: 0x00   (MM)
0x40: 0x7f   (MM)
0x41: 0x7f   (MM)
0x42: 0x7f   (MM)
0x43: 0x7f   (MM)
0x44: 0x5a   (MM)
0x45: 0x7f   (MM)
0x50: 0xff   (0x00)
0x51: 0xf8   (0x00)
0x52: 0x7f   (0x7f)
0x53: 0x7f   (0x7f)
0x54: 0x5a   (0x7f)
0x55: 0xc0   (0x40)
0x56: 0x5c   (0x00)
0x57: 0x5c   (0x00)
0x58: 0x90   (0x90)
0x59: 0x5c   (0x00)
0x5b: 0x12   (0x12)
0x5c: 0x65   (0x60)
0x5d: 0x00   (0x00)
0x5e: 0x00   (0x00)
0x5f: 0x00   (0x00)
0x60: 0x00   (0x7f)
0x61: 0x14   (0x7f)
0x62: 0x41   (0x7f)
0x63: 0x46   (0x00)
0x64: 0x1c   (0x00)
0x65: 0x03   (0x7f)
0x66: 0x00   (0x0f)
0x68: 0x00   (0x7f)
0x69: 0x14   (0x7f)
0x6a: 0x41   (0x7f)
0x6b: 0x46   (0x00)
0x6c: 0x20   (0x00)
0x6d: 0x03   (0x7f)
0x6e: 0x00   (0x0f)
0x70: 0x00   (0x7f)
0x71: 0x14   (0x7f)
0x72: 0x41   (0x7f)
0x73: 0x46   (0x00)
0x74: 0x1c   (0x00)
0x75: 0x03   (0x7f)
0x76: 0x00   (0x0f)
0x80: 0x00   (NA)
0x81: 0x00   (NA)
0x82: 0x00   (NA)
0x83: 0x00   (NA)
0x84: 0x00   (MM)
0x85: 0x00   (MM)
0x86: 0x00   (MM)
0x87: 0x00   (MM)
0x88: 0x02   (0x00)
0x89: 0x30   (0x00)
0x8a: 0x01   (0x00)
0x8b: 0x02   (0x00)
0x8c: 0x01   (0x00)
0x8d: 0xbe   (0x00)
0x8e: 0x20   (0x00)
0x8f: 0x3d   (NA)
0x90: 0xff   (0xff)
0x91: 0x00   (0x00)
0x92: 0x00   (0x00)
0x94: 0xff   (0xff)
0x95: 0x00   (0x00)
0x96: 0x00   (0x00)
0x98: 0x40   (0x00)
0x99: 0x00   (0x00)
0x9c: 0x00   (0x00)
0x9d: 0xcf   (MM)
0x9e: 0x00   (0x00)
0x9f: 0x7c   (MM)

BRAM (0x0000)
